{
  "schema_version": "1.0",
  "run_id": "",
  "created_at": "",
  "updated_at": "",
  "mode": "full",
  "status": "created",
  "inputs": {
    "video_path": "",
    "transcript_path": "",
    "brief_path": ""
  },
  "capabilities": {},
  "stages": {},
  "artifacts": [],
  "errors": [],
  "warnings": []
}